DEPARTMENT,CATEGORY,UPC,PRODUCT_URL,PRODUCT_NAME,BRAND,PRICE_RETAIL,PRODUCT_SIZE,tid,AISLE_NUMBER,SECTION,SHELF_LEVEL,SHELF_POSITION,BAY_NUMBER,health_score
Candy,Chocolate,100731,https://www.walmart.com/ip/Turtles-the-Original-Nut-Cluster-Bites-6-3-oz/582310066?fulfillmentIntent=Pickup,"Turtles the Original Nut Cluster Bites, 6.3 oz",Turtles,4.2,6.3,16364471,30,E,6,2,2,5
Candy,Chocolate,90287,https://www.walmart.com/ip/Sam-s-Choice-Belgian-Chocolate-Pumpkin-Truffles-5-3-oz-12-Count/937563148?fulfillmentIntent=Pickup,"Sam's Choice Belgian Chocolate Pumpkin Truffles, 5.3 oz, 12 Count",Sam's Choice,9.98,5.3,16223254,30,E,2,18,8,5
Candy,Chocolate,87303,https://www.walmart.com/ip/ChocoMaker-Milk-Chocolate-Flavored-Candy-Wafers-16oz-Standup-Pouch-6-per-case/363797582?fulfillmentIntent=Pickup,ChocoMaker Milk Chocolate Flavored Candy Wafers - 16oz Standup Pouch - 6 per case,ChocoMaker,4.18,16,16183064,30,E,6,14,4,7
Candy,Chocolate,87358,https://www.walmart.com/ip/Skittles-Snickers-More-Bulk-Halloween-Candy-Variety-80-36oz-260Ct/776516900?fulfillmentIntent=Pickup,"Skittles, Snickers & More Bulk Halloween Candy Variety - 80.36oz/260Ct",Mixed,21.98,80.36,16183165,30,E,1,9,9,4
Candy,Chocolate,88963,https://www.walmart.com/ip/REESE-S-THiNS-Dark-Chocolate-Peanut-Butter-Cups-Candy-Individually-Wrapped-3-1-oz-Bag/292306767?fulfillmentIntent=Pickup,"REESE'S, THiNS Dark Chocolate Peanut Butter Cups Candy, Individually Wrapped, 3.1 oz, Bag",Reese's,2.14,3.1,16211002,30,E,4,14,4,3
Candy,Chocolate,87627,https://www.walmart.com/ip/Lindt-EXCELLENCE-Sea-Salt-Dark-Chocolate-Candy-Bar-3-5-oz-Bar/21268920?fulfillmentIntent=Pickup,"Lindt EXCELLENCE Sea Salt Dark Chocolate Candy Bar, 3.5 oz. Bar",Lindt,2.94,3.5,16198017,30,E,6,18,8,4
Candy,Chocolate,94242,https://www.walmart.com/ip/MOUNDS-Dark-Chocolate-and-Coconut-Candy-Bars-Gluten-Free-3-5-oz-King-Size-Pack-4-Pieces/38253447?fulfillmentIntent=Pickup,"MOUNDS, Dark Chocolate and Coconut Candy Bars, Gluten Free, 3.5 oz, King Size Pack (4 Pieces)",Mounds,1.98,3.5,16281636,30,E,3,13,3,7
Candy,Chocolate,99561,https://www.walmart.com/ip/HERSHEY-S-Miniatures-Assorted-Milk-and-Dark-Chocolate-Candy-Bars-Individually-Wrapped-10-4-oz-Share-Pack/594537786?fulfillmentIntent=Pickup,"HERSHEY'S, Miniatures Assorted Milk and Dark Chocolate Candy Bars, Individually Wrapped, 10.4 oz, Share Pack",Hershey's,4.34,10.4,16348631,30,E,6,12,2,7
Candy,Chocolate,91956,https://www.walmart.com/ip/Reese-s-Big-Cup-King-Size-Peanut-Butter-Milk-Chocolate-Candy-Cups-2-8-Oz/33411325?fulfillmentIntent=Pickup,"Reese's Big Cup King Size Peanut Butter Milk Chocolate Candy Cups, 2.8 Oz",Reese's,1.98,2.8,16249811,30,E,3,7,7,3
Candy,Chocolate,101183,https://www.walmart.com/ip/Pez-Dispenser-Sour-Assorted-Flavors-Candy-Refills-2-9-Oz-10-Count/272114346?fulfillmentIntent=Pickup,"Pez Dispenser Sour & Assorted Flavors Candy Refills, 2.9 Oz., 10 Count",PEZ,1.88,2.9,16365481,30,E,2,14,4,7
Candy,Chocolate,90607,https://www.walmart.com/ip/Kinder-Bueno-Mini-Crispy-Creamy-Milk-Chocolate-Bites-Individually-Wrapped-Pieces-9-5-oz-Family-Pack/410291156?fulfillmentIntent=Pickup,"Kinder Bueno Mini Crispy Creamy Milk Chocolate Bites, Individually Wrapped Pieces, 9.5 oz Family Pack",Kinder Bueno,7.68,9.5,16242555,30,E,4,18,8,8
Candy,Chocolate,86272,https://www.walmart.com/ip/Ferrero-Rocher-Collection-Fine-Hazelnut-Milk-Chocolates-12-Count-Gift-Box-Assorted-Coconut-Candy-and-Chocolates-4-6-oz/133519717?fulfillmentIntent=Pickup&athbdg=L1600,"Ferrero Rocher Collection, Fine Hazelnut Milk Chocolates, 12 Count, Gift Box, Assorted Coconut Candy and Chocolates, 4.6 oz",Ferrero Rocher,5.28,4.6,16167633,30,E,1,3,3,7
Candy,Chocolate,100088,https://www.walmart.com/ip/Baby-Ruth-Chocolatey-Peanut-Caramel-Nougat-Individually-Wrapped-Fun-Size-Candy-Great-for-Halloween-Candy-10-2-oz/190742778?fulfillmentIntent=Pickup,"Baby Ruth, Chocolatey, Peanut, Caramel, Nougat, Individually Wrapped Fun Size Candy, Great for Halloween Candy, 10.2 oz",Baby Ruth,3.48,10.2,16355123,30,E,5,19,9,7
Candy,Chocolate,86341,https://www.walmart.com/ip/Lindt-EXCELLENCE-90-Cocoa-Dark-Chocolate-Candy-Bar-3-5-oz-Bar/21268921?fulfillmentIntent=Pickup,"Lindt EXCELLENCE 90% Cocoa Dark Chocolate Candy Bar, 3.5 oz. Bar",Lindt,2.94,3.5,16167828,30,E,4,12,2,4
Candy,Chocolate,94584,https://www.walmart.com/ip/GHIRARDELLI-Chocolate-Caramel-Squares-Assortment-16-1-Oz/357515452?fulfillmentIntent=Pickup,GHIRARDELLI Chocolate Caramel Squares Assortment - 16.1 Oz.,Ghirardelli,10.88,16.1,16282463,30,E,3,15,5,7
